id,name,group,budget,startMonth,color,status,meetingStartDate,meetingEndDate
1,การพัฒนาศักยภาพเกษตรกรตามแนวทฤษฎีใหม่,กลุ่มอำนวยการ,150000,0,bg-blue-600,กำลังดำเนินการ,2024-10-15,2024-10-19
2,กิจกรรมส่งเสริมการผลิตข้าวอินทรีย์,กลุ่มส่งเสริมและพัฒนาการเกษตร,300000,1,bg-green-600,กำลังดำเนินการ,2024-11-20,2024-11-17
3,กิจกรรมส่งเสริมผลิตภัณฑ์ชุมชน,กลุ่มส่งเสริมวิสาหกิจชุมชนและผู้ประกอบการ,80000,4,bg-purple-600,ยังไม่เริ่ม,2025-02-10,2025-02-02
4,การอบรมการตลาดออนไลน์,กลุ่มส่งเสริมการตลาด,220000,5,bg-orange-600,ยังไม่เริ่ม,2025-03-25,2025-03-01
5,กิจกรรมส่งเสริมเกษตรกรรมวิธีธรรมชาติ,กลุ่มส่งเสริมและพัฒนาเกษตรกร,450000,9,bg-pink-600,ยังไม่เริ่ม,,
6,การพัฒนาระบบสารสนเทศเกษตร,กลุ่มยุทธศาสตร์และสารสนเทศ,180000,2,bg-cyan-600,กำลังดำเนินการ,,
7,การสำรวจข้อมูลพื้นฐาน,กลุ่มอำนวยการ,95000,6,bg-gray-600,ยังไม่เริ่ม,,
